location_id,location,rating,num_rating,price_level,url,types,coordinates,top5reviews
id_0,starbucks Millennium City 1,3.5,1197,2,https://maps.google.com/?cid=8288864725983255405,"['cafe', 'food', 'store', 'point_of_interest', 'establishment']","{'lat': 22.3138708, 'lng': 114.2212228}","[{'author_name': 'Jude S Mendes', 'author_url': 'https://www.google.com/maps/contrib/111922296572406685929/reviews', 'language': 'en', 'original_language': 'en', 'profile_photo_url': 'https://lh3.googleusercontent.com/a-/AD_cMMR4-zsP2r577JqheWLhuZ8zc5Hw41RXj1VyHMnlLg=s128-c0x00000000-cc-rp-mo-ba6', 'rating': 3, 'relative_time_description': '3 months ago', 'text': ""I didn't like the Hazelnut coffee that they are promoting now, the taste was a bit funny"", 'time': 1677813920, 'translated': False}, {'author_name': 'Danny Hung', 'author_url': 'https://www.google.com/maps/contrib/108457914638100714597/reviews', 'language': 'en', 'original_language': 'en', 'profile_photo_url': 'https://lh3.googleusercontent.com/a-/AD_cMMS1oFFpkYjJs7yD6wtpjUsuCLeFa4wbga00lKypEQ=s128-c0x00000000-cc-rp-mo-ba7', 'rating': 2, 'relative_time_description': '7 months ago', 'text': 'Standard Provision and the price is high.', 'time': 1666270567, 'translated': False}, {'author_name': 'Charis Wong', 'author_url': 'https://www.google.com/maps/contrib/108994906039335958980/reviews', 'language': 'en', 'original_language': 'en', 'profile_photo_url': 'https://lh3.googleusercontent.com/a/AAcHTtdH7En4IvY8n7T5MNCqkZbS3z-1Y0Pt8yXwQ-wq=s128-c0x00000000-cc-rp-mo-ba6', 'rating': 1, 'relative_time_description': '2 years ago', 'text': 'Very bad buying experience, not only once.\nThis time, I ordered the usual drink and the taste is different. The staff informed me that maybe stir or not stir, more foam or less foam.\nI don\'t know why she thinks inconsistency is accepted but the point is the taste is really nasty. She suggested me to change another drink next time (though I have ordered this for years, from different shops including this one). I can see rather than improve themselves, she asked a customer to change a taste. I remember the slogan of starbucks is unlike this.....\n\nAfter changing another cup for me, she asked me to try immediately. I told her the temperature is too hot for me. She just said ""huh, it is normal temperature."" I wonder I paid for this kind of courtesy. I admit it is normal for 30-40+degrees in Thailand but doesn\'t mean it is normal to me.\n\nI suggest the staff could think more about customer, not think as her own way\n\nBy the way, the second drink is better.', 'time': 1612489866, 'translated': False}, {'author_name': 'Simon Lau', 'author_url': 'https://www.google.com/maps/contrib/114253985350694548379/reviews', 'language': 'en', 'original_language': 'en', 'profile_photo_url': 'https://lh3.googleusercontent.com/a/AAcHTtcb2KM3P6PvrBIitp2Uarmou4ZLnx_hN-b7QEe_=s128-c0x00000000-cc-rp-mo-ba4', 'rating': 5, 'relative_time_description': '5 years ago', 'text': 'hospitable', 'time': 1509613654, 'translated': False}, {'author_name': 'Joseph Chow', 'author_url': 'https://www.google.com/maps/contrib/112512342640515216166/reviews', 'language': 'en', 'original_language': 'en', 'profile_photo_url': 'https://lh3.googleusercontent.com/a-/AD_cMMTjRoWQE2c07KFSi_657Oy25nLElhBwrs1686tECA=s128-c0x00000000-cc-rp-mo-ba7', 'rating': 3, 'relative_time_description': '3 years ago', 'text': 'Most of the tables were set in the lobby which too many people walking around.  Seats were available during non-lunch hours.  Quality of drink and food were standardized.', 'time': 1560496005, 'translated': False}]"
id_1,starbucks Austin Road,3.9,620,2,https://maps.google.com/?cid=8712621936325251985,"['cafe', 'food', 'point_of_interest', 'store', 'establishment']","{'lat': 22.3031681, 'lng': 114.1723191}","[{'author_name': 'tomato tam', 'author_url': 'https://www.google.com/maps/contrib/100750415791246578936/reviews', 'language': 'en', 'original_language': 'en', 'profile_photo_url': 'https://lh3.googleusercontent.com/a-/AD_cMMReUl9pR1OIrY2fCh0IL1z5T8KwQ5Hv9FHdhtJFRVA=s128-c0x00000000-cc-rp-mo-ba7', 'rating': 4, 'relative_time_description': 'a year ago', 'text': 'convenient location. cafe on ground floor. easy assess for the disabled . nice environment. helpful staff. vegetarian food is available.', 'time': 1635438048, 'translated': False}, {'author_name': 'Ron S', 'author_url': 'https://www.google.com/maps/contrib/112796231971608018040/reviews', 'language': 'en', 'original_language': 'en', 'profile_photo_url': 'https://lh3.googleusercontent.com/a-/AD_cMMSfDOv9-ip3nXvA8Mi86Kklhl6G7iPCqxi2IsYwsdg=s128-c0x00000000-cc-rp-mo-ba6', 'rating': 4, 'relative_time_description': 'a month ago', 'text': 'Spacious shop, too crowded table arrangement though.', 'time': 1682140373, 'translated': False}, {'author_name': 'Bernd Esch', 'author_url': 'https://www.google.com/maps/contrib/116552972563527957030/reviews', 'language': 'en', 'original_language': 'en', 'profile_photo_url': 'https://lh3.googleusercontent.com/a-/AD_cMMQ-udRRrg_eNymrYx-AtXLIwXCaiTCMHAF_r21BnyY=s128-c0x00000000-cc-rp-mo-ba7', 'rating': 2, 'relative_time_description': 'a year ago', 'text': ""The usual Starbucks fare in a good location. The tables are not clean, and actually sticky. They don't seem to take good care of their furniture."", 'time': 1625543894, 'translated': False}, {'author_name': 'Juvenly June', 'author_url': 'https://www.google.com/maps/contrib/108601712844129123239/reviews', 'language': 'en', 'original_language': 'en', 'profile_photo_url': 'https://lh3.googleusercontent.com/a-/AD_cMMSQeuT75SFNnc0hEJwbPZa93ajkolRHdt7yobAR=s128-c0x00000000-cc-rp-mo', 'rating': 4, 'relative_time_description': 'a month ago', 'text': 'near mtr jordan', 'time': 1680940985, 'translated': False}, {'author_name': 'Alex Matthews', 'author_url': 'https://www.google.com/maps/contrib/108281583811332957266/reviews', 'language': 'en', 'original_language': 'en', 'profile_photo_url': 'https://lh3.googleusercontent.com/a-/AD_cMMQzVc9-u0ggZO0aUin1YZON8cQxNkcI0WmDGXUvMms=s128-c0x00000000-cc-rp-mo-ba3', 'rating': 5, 'relative_time_description': '3 months ago', 'text': 'What you suspect from a Starbucks but very quick service', 'time': 1675835577, 'translated': False}]"
id_2,starbucks Megabox L6,3.6,173,2,https://maps.google.com/?cid=1097530559964241689,"['cafe', 'food', 'point_of_interest', 'store', 'establishment']","{'lat': 22.3198699, 'lng': 114.2085334}","[{'author_name': 'Ivan T', 'author_url': 'https://www.google.com/maps/contrib/111918805897327018649/reviews', 'language': 'en', 'original_language': 'en', 'profile_photo_url': 'https://lh3.googleusercontent.com/a-/AD_cMMT3FbFXV9Nga9AcjiJzObrYyaAialHW2IL44bk9zHU=s128-c0x00000000-cc-rp-mo-ba6', 'rating': 1, 'relative_time_description': '4 years ago', 'text': ""Nothing special and useful only for a quick break.\n\nSign at pick up counter says plastic utensils given upon request but mine were given out regardless.\n\nAsked for metal knife and fork but didn't have any. Pacific Coffee usually has plastic and metal."", 'time': 1544702877, 'translated': False}, {'author_name': 'T Lo', 'author_url': 'https://www.google.com/maps/contrib/116313205053057135328/reviews', 'language': 'en', 'original_language': 'en', 'profile_photo_url': 'https://lh3.googleusercontent.com/a/AAcHTtfBQD3lfmIuBnNQ9jvjgPjtoCtAoC4MjwDjIhZzc3c=s128-c0x00000000-cc-rp-mo-ba6', 'rating': 3, 'relative_time_description': '6 years ago', 'text': 'Standard Starbucks quality, never surprising and good enough to have a seat to refresh in the mall.', 'time': 1484541087, 'translated': False}, {'author_name': 'Robert MacFarland', 'author_url': 'https://www.google.com/maps/contrib/110831871656705691526/reviews', 'language': 'en', 'original_language': 'en', 'profile_photo_url': 'https://lh3.googleusercontent.com/a-/AD_cMMQ1bGKzzq22ulTcsVkwI6OEYiYPGlTJpAcM1f6v=s128-c0x00000000-cc-rp-mo-ba4', 'rating': 1, 'relative_time_description': '4 years ago', 'text': 'MegaBox Starbucks coffee today was like drinking Battery Acid.  Apparently, none of the servers drinks coffee or ever actually \'tastes\' the poison they are serving.  I am going to McDonalds on ground floor for a fresh cup of coffee.\n(Update)  today I waited about 8 minutes for group in front to figure out their phone pay.  Then I ask for a tall coffee.  She asked me ""what size tall coffee?"".  Then she tells me they dont have any coffee made, can I wait while they start brewing some?\nThis is second Starbucks this week that has no coffee made...happens 50% of time at Dundas Street.  Usually takes about 15 minutes to get a normal cup of coffee.  Unbelievable!', 'time': 1543212128, 'translated': False}, {'author_name': 'Asad Ali', 'author_url': 'https://www.google.com/maps/contrib/102228625451362754609/reviews', 'language': 'en', 'original_language': 'en', 'profile_photo_url': 'https://lh3.googleusercontent.com/a-/AD_cMMQCtOvJZ04_cbKG45GbqsqaE5YfAnYGjH2Q8Ocn1g=s128-c0x00000000-cc-rp-mo-ba3', 'rating': 1, 'relative_time_description': 'a year ago', 'text': ""Highly non recommended this Starbucks in MegaBox. Non professional staff and don't know how to provide services"", 'time': 1634481784, 'translated': False}, {'author_name': 'Arne Theuerkauf', 'author_url': 'https://www.google.com/maps/contrib/109583289482073426333/reviews', 'language': 'en', 'original_language': 'en', 'profile_photo_url': 'https://lh3.googleusercontent.com/a-/AD_cMMT3w-zxnNtDJkODCmscknvMKpMtKmWlszU3ZzOU56Q=s128-c0x00000000-cc-rp-mo-ba8', 'rating': 4, 'relative_time_description': '2 years ago', 'text': 'Small space, but staff is very friendly and very helpful.', 'time': 1591874205, 'translated': False}]"
id_3,starbucks South Horizon,3.9,164,2,https://maps.google.com/?cid=1630185514670291244,"['cafe', 'point_of_interest', 'store', 'food', 'establishment']","{'lat': 22.2438524, 'lng': 114.1463329}","[{'author_name': 'tobi d.', 'author_url': 'https://www.google.com/maps/contrib/113680293965071430032/reviews', 'language': 'en', 'original_language': 'en', 'profile_photo_url': 'https://lh3.googleusercontent.com/a-/AD_cMMRSZ8_r3PdItbOTI-3cdL3zXTMnCax7dyUnJtYDHg=s128-c0x00000000-cc-rp-mo-ba5', 'rating': 1, 'relative_time_description': 'a year ago', 'text': 'Now that was just the worst Starbucks staff I  ever encountered in a Starbucks around the world. Thought it was me but the next guy in line - Cantonese speaking - had the same issues that the staff tried to ‚pre-empt‘ what he would order and not just listen to the order.  In the end I just said whatever and made sure the lady at the coffee machines did everything right - since he did not communicate which reusable cup was for which drink either to her - so she promptly got it mixed up.\nNot sure how Starbucks accepts such untrained / does not train staff before they work the counter.\nFrustrating experiences like this in the morning ruin a day - thank you Starbucks.', 'time': 1633916758, 'translated': False}, {'author_name': 'Paddy C', 'author_url': 'https://www.google.com/maps/contrib/101534141057950565039/reviews', 'language': 'en', 'original_language': 'en', 'profile_photo_url': 'https://lh3.googleusercontent.com/a/AAcHTtedJJP3NAic7DFEnQHWKGYaA7ijK37iKtKATv9A=s128-c0x00000000-cc-rp-mo-ba5', 'rating': 3, 'relative_time_description': '2 weeks ago', 'text': 'Same as any SB around the world', 'time': 1684458785, 'translated': False}, {'author_name': 'Jonathan Ng', 'author_url': 'https://www.google.com/maps/contrib/116813765656503773081/reviews', 'language': 'en', 'original_language': 'en', 'profile_photo_url': 'https://lh3.googleusercontent.com/a/AAcHTtfv5XR-TR9Mwz6GVhd1ByAvxwgfWsNCYGpIwQ-F=s128-c0x00000000-cc-rp-mo-ba5', 'rating': 5, 'relative_time_description': '3 years ago', 'text': 'Newly renovated shop. Looks very nice and setting is comfortable for a place to talk or enjoy coffee alone. I usually come here every week for coffee.', 'time': 1575901102, 'translated': False}, {'author_name': 'Michael Tam', 'author_url': 'https://www.google.com/maps/contrib/107612427897778765024/reviews', 'language': 'en', 'original_language': 'en', 'profile_photo_url': 'https://lh3.googleusercontent.com/a-/AD_cMMTmOPe2Goe4Touc6pb7hZT_IaRACw1uYCCdhRx0tg=s128-c0x00000000-cc-rp-mo-ba6', 'rating': 4, 'relative_time_description': '4 years ago', 'text': 'Generally, the location and shop are nice, the coffee is good but pricey.', 'time': 1548589324, 'translated': False}, {'author_name': 'Douglas Wong', 'author_url': 'https://www.google.com/maps/contrib/101610725505918033033/reviews', 'language': 'en', 'original_language': 'en', 'profile_photo_url': 'https://lh3.googleusercontent.com/a-/AD_cMMSqLWSP50G2MpFlAHLoorIlwDBXvBYXj_9wuLf_gQ=s128-c0x00000000-cc-rp-mo-ba7', 'rating': 3, 'relative_time_description': '4 years ago', 'text': 'Service nice. But shop needs better interior design to look more elegant.', 'time': 1549508360, 'translated': False}]"
id_4,starbucks One Kowloon,3.7,246,2,https://maps.google.com/?cid=2838599111857756166,"['cafe', 'food', 'point_of_interest', 'store', 'establishment']","{'lat': 22.3206397, 'lng': 114.2100814}","[{'author_name': 'Arne Theuerkauf', 'author_url': 'https://www.google.com/maps/contrib/109583289482073426333/reviews', 'language': 'en', 'original_language': 'en', 'profile_photo_url': 'https://lh3.googleusercontent.com/a-/AD_cMMT3w-zxnNtDJkODCmscknvMKpMtKmWlszU3ZzOU56Q=s128-c0x00000000-cc-rp-mo-ba8', 'rating': 3, 'relative_time_description': '4 years ago', 'text': 'Nicely placed in the lobby of this office building. Great for take away, but if you want to stay, there is only limited seating available.', 'time': 1547899062, 'translated': False}, {'author_name': 'Joseph Chow', 'author_url': 'https://www.google.com/maps/contrib/112512342640515216166/reviews', 'language': 'en', 'original_language': 'en', 'profile_photo_url': 'https://lh3.googleusercontent.com/a-/AD_cMMTjRoWQE2c07KFSi_657Oy25nLElhBwrs1686tECA=s128-c0x00000000-cc-rp-mo-ba7', 'rating': 3, 'relative_time_description': '4 years ago', 'text': 'There were only a few tables in this shop.  Lunch time was the busiest hour and hard to find a seat to din in.', 'time': 1532836038, 'translated': False}, {'author_name': 'David Dixon', 'author_url': 'https://www.google.com/maps/contrib/110494514107558004797/reviews', 'language': 'en', 'original_language': 'en', 'profile_photo_url': 'https://lh3.googleusercontent.com/a-/AD_cMMSwFgd4FoQ1xXTNGKwZkYtBybp5zl4RLh5SW-0SOVw=s128-c0x00000000-cc-rp-mo-ba6', 'rating': 3, 'relative_time_description': '9 years ago', 'text': ""This Starbucks is not in the building we intended to go in. We did grab starbucks, but if I had known a Pret was in the building we were supposed to be in, we wouldn't have been late to the meeting and we would have had Pret."", 'time': 1401387681, 'translated': False}, {'author_name': 'Shubhraketan Halder', 'author_url': 'https://www.google.com/maps/contrib/104023413195359552796/reviews', 'language': 'en', 'original_language': 'en', 'profile_photo_url': 'https://lh3.googleusercontent.com/a-/AD_cMMTeC7PxXCxgYHTmyHcTg8OadFCAUl3d3Df6heKuIQ=s128-c0x00000000-cc-rp-mo-ba2', 'rating': 4, 'relative_time_description': '6 years ago', 'text': ""Nice place, very convenient if you're trying to grab a coffee on the run to One Kowloon office"", 'time': 1486629860, 'translated': False}, {'author_name': 'Jośe K', 'author_url': 'https://www.google.com/maps/contrib/106071267878099267405/reviews', 'language': 'en', 'original_language': 'en', 'profile_photo_url': 'https://lh3.googleusercontent.com/a/AAcHTtetJ3dltjV-4D4JoOLVa8Eji4rStpfLRnuXWJ49=s128-c0x00000000-cc-rp-mo-ba4', 'rating': 4, 'relative_time_description': '2 years ago', 'text': 'Located at one of the commercial complex, it provide a cozy enviro for chit chat and chilling.', 'time': 1591545909, 'translated': False}]"
id_5,starbucks Jardine House G/F,3.9,455,2,https://maps.google.com/?cid=13637002952746085887,"['cafe', 'store', 'food', 'point_of_interest', 'establishment']","{'lat': 22.2831586, 'lng': 114.1590378}","[{'author_name': 'Stephen Tsang', 'author_url': 'https://www.google.com/maps/contrib/108267145947228708386/reviews', 'language': 'en', 'original_language': 'en', 'profile_photo_url': 'https://lh3.googleusercontent.com/a-/AD_cMMRLNoE26q2RvuY1kvnWoO3iJTRODtXHSQGkfXsrmg=s128-c0x00000000-cc-rp-mo-ba6', 'rating': 4, 'relative_time_description': '2 months ago', 'text': 'Fast & good service. Tidy & cozy environment.', 'time': 1678231570, 'translated': False}, {'author_name': 'naoko sasaki', 'author_url': 'https://www.google.com/maps/contrib/115242281471051974936/reviews', 'language': 'en', 'original_language': 'en', 'profile_photo_url': 'https://lh3.googleusercontent.com/a/AAcHTte1-L90jYLLkgKr_7qvwYvyem-yP4fnAvuBu647=s128-c0x00000000-cc-rp-mo', 'rating': 1, 'relative_time_description': '4 weeks ago', 'text': 'There are 5 staff at the counter but only one guy is preparing the beverage. The girl at cashier is chatting with another staff. I ended up waiting for simple beverage for 20 mins! So unproductive.', 'time': 1683358917, 'translated': False}, {'author_name': 'Y L', 'author_url': 'https://www.google.com/maps/contrib/111390256375368936555/reviews', 'language': 'en', 'original_language': 'en', 'profile_photo_url': 'https://lh3.googleusercontent.com/a-/AD_cMMRYSrKOtCrnngnihHhh870IWTBluUzapbKGuteduDQ=s128-c0x00000000-cc-rp-mo-ba6', 'rating': 4, 'relative_time_description': 'a year ago', 'text': 'A nice place to stop, sip a coffee, take a short break then carry on working.', 'time': 1623645820, 'translated': False}, {'author_name': 'Loretta Wong', 'author_url': 'https://www.google.com/maps/contrib/103858806076991851578/reviews', 'language': 'en', 'original_language': 'en', 'profile_photo_url': 'https://lh3.googleusercontent.com/a-/AD_cMMTveeD1bBF4j04y4viuEz4ZeDag7YFR1kjiZPfJ6g=s128-c0x00000000-cc-rp-mo-ba5', 'rating': 4, 'relative_time_description': '4 years ago', 'text': 'A nice place near to the harbourfront and City hall. Very convenient to have a quick bite before attending concerts. Quite cold and windy during winter time. Seats quite packed unless you are sitting on sofas.', 'time': 1543078769, 'translated': False}, {'author_name': 'Tina Hon', 'author_url': 'https://www.google.com/maps/contrib/113917041321128550623/reviews', 'language': 'en', 'original_language': 'en', 'profile_photo_url': 'https://lh3.googleusercontent.com/a-/AD_cMMSgdVUMSh0ovUYRc2iNetPPi1KB5VEvUDg-mF0q-g=s128-c0x00000000-cc-rp-mo-ba2', 'rating': 5, 'relative_time_description': '10 months ago', 'text': ""I told her my name and letters one by one but still it's  wrong but it's understandable."", 'time': 1658828816, 'translated': False}]"
id_6,starbucks Sai Kung Chan Man Street*,3.9,344,2,https://maps.google.com/?cid=9961621159686335875,"['cafe', 'store', 'food', 'point_of_interest', 'establishment']","{'lat': 22.3823031, 'lng': 114.2717268}","[{'author_name': 'Keyser Soze', 'author_url': 'https://www.google.com/maps/contrib/102563305927833862087/reviews', 'language': 'en', 'original_language': 'en', 'profile_photo_url': 'https://lh3.googleusercontent.com/a-/AD_cMMQNuy5LLZtzbD5XWxRAraz-L6vwt6rfd9Q5ygr4_Q=s128-c0x00000000-cc-rp-mo', 'rating': 4, 'relative_time_description': 'a month ago', 'text': 'Nice place to sit, have a tea, coffee, etc., and watch the world go by', 'time': 1681438563, 'translated': False}, {'author_name': 'Dion', 'author_url': 'https://www.google.com/maps/contrib/108090535467504327136/reviews', 'language': 'en', 'original_language': 'en', 'profile_photo_url': 'https://lh3.googleusercontent.com/a-/AD_cMMSxH0vp-2SywCKlC0LnW0-1QJnYZjMJ1RI7tI8N3g=s128-c0x00000000-cc-rp-mo-ba5', 'rating': 4, 'relative_time_description': '5 years ago', 'text': 'Good and fast service, central location near supermarket, good coffee and danishes, free wifi for 30 minutes', 'time': 1508437652, 'translated': False}, {'author_name': 'Mr Plau', 'author_url': 'https://www.google.com/maps/contrib/114577146700051487526/reviews', 'language': 'en', 'original_language': 'en', 'profile_photo_url': 'https://lh3.googleusercontent.com/a-/AD_cMMS7QYM_mXeTD7qjrtOs_XBXx2uDnchBeJ6QhuKsfw=s128-c0x00000000-cc-rp-mo-ba4', 'rating': 5, 'relative_time_description': 'a year ago', 'text': ""I rate this place as a five star only because of the staff. Without the staff I wouldn't care at all. Every time I go, the entire staff is so friendly and helpful. They always talk to me a little and I do my best to clear up after myself as they are always busy. There was a very rude American in there today who I imagine would have made other people hostile. Not these guys. They were still courteous and lovely. I hope they get to deal with better customers in the future. Thank you for looking after myself and the many others in the community."", 'time': 1625542845, 'translated': False}, {'author_name': 'Geo Cacher (CX15)', 'author_url': 'https://www.google.com/maps/contrib/113215364269824727727/reviews', 'language': 'en', 'original_language': 'en', 'profile_photo_url': 'https://lh3.googleusercontent.com/a-/AD_cMMTUvW5Rb1D5rU3F-kTDjlnbxCv2fm4S3n5J2r1q=s128-c0x00000000-cc-rp-mo-ba6', 'rating': 4, 'relative_time_description': '6 months ago', 'text': ""Finally it's been remodelled! Much cleaner and brighter inside now.\nService a bit iffy, but maybe just a bad day today.\n\nGreat place to sit!"", 'time': 1669349552, 'translated': False}, {'author_name': 'Anil Arora', 'author_url': 'https://www.google.com/maps/contrib/113102631888778171509/reviews', 'language': 'en', 'original_language': 'en', 'profile_photo_url': 'https://lh3.googleusercontent.com/a-/AD_cMMQEw2VfzPXG_7Rnwe4RfrMEFE6aacAaengQpIySVg=s128-c0x00000000-cc-rp-mo-ba5', 'rating': 5, 'relative_time_description': '2 years ago', 'text': ""Very warm and welcoming staff to greet. Nothing to write about taste as it's same everywhere. Ambiance was nice and was giving a happy and positive vibes. They do have washrooms"", 'time': 1617756903, 'translated': False}]"
id_7,starbucks Airport - Gate 44,4.0,874,2,https://maps.google.com/?cid=2122995671238776817,"['cafe', 'point_of_interest', 'store', 'food', 'establishment']","{'lat': 22.31102689999999, 'lng': 113.9263993}","[{'author_name': 'khanhtrang letran', 'author_url': 'https://www.google.com/maps/contrib/104360230329545502270/reviews', 'language': 'en', 'original_language': 'en', 'profile_photo_url': 'https://lh3.googleusercontent.com/a-/AD_cMMSdlsFwblq3YbCVm8uBpRIrSXR7U0ocGZNHFk0f=s128-c0x00000000-cc-rp-mo-ba6', 'rating': 5, 'relative_time_description': '4 years ago', 'text': ""It is a small shop at the departure hall in Hongkong international airport. The shop is quite small but have a lot of drink option, and sandwiches, cakes. A minor point is too expensive, 48HKD for 1 venti cup of green tea with jelly and only take away. Shop don't have space to sit, but outside, in the departure hall, they put a lot of chair and table for passengers. Love it"", 'time': 1550623515, 'translated': False}, {'author_name': 'Madel Tejano', 'author_url': 'https://www.google.com/maps/contrib/114402094179423210513/reviews', 'language': 'en', 'original_language': 'en', 'profile_photo_url': 'https://lh3.googleusercontent.com/a/AAcHTtfHP-s3OZDnJfDxlW9WMkI6jJeMqnHF7hiQCodZ=s128-c0x00000000-cc-rp-mo-ba2', 'rating': 1, 'relative_time_description': '11 months ago', 'text': 'Starbucks Hong Kong Aiport is closed. Lay over for almost 10 hours and there is not a single café, restaurant and fast food chain open. Update your sites. People like me who does not speak or understand Chinese is helpless and hungry with no staff at the Information area. Ask one of the airport staff for help and she was rudely says no, no, no and spoken Chinese and left.', 'time': 1656978492, 'translated': False}, {'author_name': 'Executive Thrillseeker', 'author_url': 'https://www.google.com/maps/contrib/107024672811788833969/reviews', 'language': 'en', 'original_language': 'en', 'profile_photo_url': 'https://lh3.googleusercontent.com/a-/AD_cMMTAsHtusB2pFtwsTMwf-BEi61ciFk3YPe7XgLfJ=s128-c0x00000000-cc-rp-mo-ba6', 'rating': 5, 'relative_time_description': '3 years ago', 'text': 'The small little Starbucks location can get pretty hectic as it gets extremely busy… But they handle it very well and the consistency is on point!', 'time': 1561106752, 'translated': False}, {'author_name': 'L JA', 'author_url': 'https://www.google.com/maps/contrib/118379091760820758693/reviews', 'language': 'en', 'original_language': 'en', 'profile_photo_url': 'https://lh3.googleusercontent.com/a-/AD_cMMRoE4uJb4T5tuZIYweMOb0yVtLYFWgm84SVImYFRg=s128-c0x00000000-cc-rp-mo-ba6', 'rating': 4, 'relative_time_description': '3 years ago', 'text': 'Fantastic coffee  and snacks butthe rates are different at JFK airport  Newyork  and  Hongkong air port. At Hongkong airport the Starbucks  is expensive.', 'time': 1560326000, 'translated': False}, {'author_name': 'Tony Jeanes', 'author_url': 'https://www.google.com/maps/contrib/105626329823227651547/reviews', 'language': 'en', 'original_language': 'en', 'profile_photo_url': 'https://lh3.googleusercontent.com/a/AAcHTtdk93xEE1w19huS7jerysofcKivzMunRACrLo_s1g=s128-c0x00000000-cc-rp-mo-ba4', 'rating': 4, 'relative_time_description': '4 years ago', 'text': 'Thanks managed to grab a good coffee from you on my stop over. Though on the way back it took ages to find you again.', 'time': 1540602539, 'translated': False}]"
