location_id,location,rating,num_rating,price_level,url,types,coordinates,top5reviews
id_114,starbucks MTR-Central ** ,3.8,184,2,https://maps.google.com/?cid=3520156780064570529,"['cafe', 'point_of_interest', 'store', 'food', 'establishment']","{'lat': 22.2819989, 'lng': 114.1576766}","[{'author_name': 'nilian galaraga', 'author_url': 'https://www.google.com/maps/contrib/115696542655597484162/reviews', 'language': 'en', 'original_language': 'en', 'profile_photo_url': 'https://lh3.googleusercontent.com/a/AAcHTtcBtF8aizqDXeUR8FkCve-6n3M0ILxisozZo9PV=s128-c0x00000000-cc-rp-mo-ba2', 'rating': 5, 'relative_time_description': '4 years ago', 'text': 'I love the views in front of the building at the tower in lake silver', 'time': 1550119532, 'translated': False}, {'author_name': 'Palaniandy Sundarason', 'author_url': 'https://www.google.com/maps/contrib/105709724772824349614/reviews', 'language': 'en', 'original_language': 'en', 'profile_photo_url': 'https://lh3.googleusercontent.com/a/AAcHTtdujee0Lc9P75QruvSJH-CAEG_xOy5nSAiGJJqP=s128-c0x00000000-cc-rp-mo-ba3', 'rating': 4, 'relative_time_description': '3 years ago', 'text': 'Good place to enjoy coffee kind of stress release. ..😃 also can have small meet up...with official or with friends.', 'time': 1563765111, 'translated': False}, {'author_name': 'Reiner Bernal (rein)', 'author_url': 'https://www.google.com/maps/contrib/113905344251016553288/reviews', 'language': 'en', 'original_language': 'en', 'profile_photo_url': 'https://lh3.googleusercontent.com/a-/AD_cMMT-YhatB3zex6qv4u7w_HgqklQBckqWavx5CG_v9A=s128-c0x00000000-cc-rp-mo-ba4', 'rating': 5, 'relative_time_description': '3 years ago', 'text': 'Very convenient location with great service. Good thing the staff knew how to communicate with foreigners.', 'time': 1569438187, 'translated': False}, {'author_name': 'Sis Luzviminda Dawagan', 'author_url': 'https://www.google.com/maps/contrib/114810479036088765911/reviews', 'language': 'en', 'original_language': 'en', 'profile_photo_url': 'https://lh3.googleusercontent.com/a-/AD_cMMSlqD2R9J3zxNi9NylgbA49_lz9nJWB6Uxa0Qi66g=s128-c0x00000000-cc-rp-mo-ba3', 'rating': 5, 'relative_time_description': '4 years ago', 'text': 'I love the coffee that they serve...its delicious and different flavor to choose', 'time': 1558446663, 'translated': False}, {'author_name': 'Derek Yuen', 'author_url': 'https://www.google.com/maps/contrib/107217914028877883027/reviews', 'language': 'en', 'original_language': 'en', 'profile_photo_url': 'https://lh3.googleusercontent.com/a-/AD_cMMQ9T7sEzZEj8i8CdN18C6rWEyAEq2_233wsPp-hvl8=s128-c0x00000000-cc-rp-mo-ba3', 'rating': 4, 'relative_time_description': '6 years ago', 'text': 'Nice staffs with quick services, particularly given how busy they are during morning peak hour', 'time': 1491162689, 'translated': False}]"
id_115,starbucks Shun Tak Centre,3.8,183,2,https://maps.google.com/?cid=12975717917682094713,"['cafe', 'food', 'store', 'point_of_interest', 'establishment']","{'lat': 22.28792899999999, 'lng': 114.151898}","[{'author_name': 'Patrick Ho', 'author_url': 'https://www.google.com/maps/contrib/107178577381328278445/reviews', 'language': 'en', 'original_language': 'en', 'profile_photo_url': 'https://lh3.googleusercontent.com/a-/AD_cMMTxnFb3FTMR-pBXk-6GwQrZC8xZMGeQf8uKMV-xCQ=s128-c0x00000000-cc-rp-mo-ba5', 'rating': 4, 'relative_time_description': 'a year ago', 'text': 'A cozy and quiet Starbucks for weekends, if you are looking for one.\n\nLocated next to the Macao ferry pier in Sheung wan, it used to be a very busy one for the travellers. Thank you to the Covid and the regulations set by the government, lesser travellers between two cities and the Starbucks now become a very nice place for leisure work and chill.\n\nStaff are all very nice, seating are ok, at least you won’t feel too packed. And enough lighting for you to work on your iPad, or movies watching.\n\nIt would be great if there are some sofas for a more relaxing rest. But I’m surely satisfied with the environment now and enjoy the last bit of chill before the real normal is back.', 'time': 1651981234, 'translated': False}, {'author_name': 'ssg', 'author_url': 'https://www.google.com/maps/contrib/114154887650952138673/reviews', 'language': 'en', 'original_language': 'en', 'profile_photo_url': 'https://lh3.googleusercontent.com/a-/AD_cMMQcuqQGxbrW0yH6DLkNGS620HqpCtAd-HjhHK47Gw=s128-c0x00000000-cc-rp-mo-ba8', 'rating': 4, 'relative_time_description': '2 years ago', 'text': ""Went to Starbucks to try the new Teavana series.\n\nI don't like coffee or Hibiscus so I got the grapefruit with honey.\n\nIt had a nice strong natrual grapefruit taste but the honey was a bit too sweet for my liking.\n\nWhile I was waiting for my drink, I saw this tasting session list which starts at 3pm, since it was already 2:45pm I decided to try the tasting.\n\nWhen I asked the guy at Starbucks, he said it doesn't have to start at 3pm.\n\nBasically they have a new range of loose leaf teas by Teavana which they also sell as well.\n\nI was given a sample of the citrus mint and youthberry.\n\nThe youthberry was pleasant but I didn't like the mint because it tasted like mouthwash!\nThe guy on the left could have asked for a tasting too instead of buying non Starbucks drinks to drink at Starbucks."", 'time': 1596747006, 'translated': False}, {'author_name': 'BradJill', 'author_url': 'https://www.google.com/maps/contrib/117832408789555351833/reviews', 'language': 'en', 'original_language': 'en', 'profile_photo_url': 'https://lh3.googleusercontent.com/a-/AD_cMMTaVBZj_F9hXVP6S2M_NBqMzM6tjGK-tMDcu1w_=s128-c0x00000000-cc-rp-mo-ba8', 'rating': 3, 'relative_time_description': '4 years ago', 'text': ""Amongst other food outlets at the Shun Tak Centre (also known as the Hong Kong Macau Ferry Terminal) is a conveniently located Starbucks. Prices as well as coffee and food quality is the same as what you'll find throughout the city. Opening hours are great for early departures to Macau (6.30pm to 10pm) daily.\n\nI sometimes stop here for an espresso or doppio prior to catching ferries to Macau. Espresso is Italian roast, made properly and tastes fine. Morning pastries are also fine although I rarely eat here, preferring to wait until I arrive in Macau so I can enjoy Portuguese style tarts or other establishments I like there.\n\nYou'll find this Starbucks near the escalator leading to the Cotai Water Jet entrance into the restricted departure area. There is seating directly inside the coffee shop as well as a sectioned off open seating space near the escalator."", 'time': 1549503998, 'translated': False}, {'author_name': 'TheRDMagee', 'author_url': 'https://www.google.com/maps/contrib/111383727282459770877/reviews', 'language': 'en', 'original_language': 'en', 'profile_photo_url': 'https://lh3.googleusercontent.com/a-/AD_cMMR1i8oIY7JIgu3dOvYcnvOJ7XujBwtRbYDa3qCf3Q=s128-c0x00000000-cc-rp-mo', 'rating': 4, 'relative_time_description': '3 years ago', 'text': 'Very expensive but a nice shop.  There is a seating area outside the shop that is not quite so cold as the shop.', 'time': 1582346352, 'translated': False}, {'author_name': 'Joseph Chow', 'author_url': 'https://www.google.com/maps/contrib/112512342640515216166/reviews', 'language': 'en', 'original_language': 'en', 'profile_photo_url': 'https://lh3.googleusercontent.com/a-/AD_cMMTjRoWQE2c07KFSi_657Oy25nLElhBwrs1686tECA=s128-c0x00000000-cc-rp-mo-ba7', 'rating': 2, 'relative_time_description': '3 years ago', 'text': 'Lots of patrons and non-patrons occupied the seats.  Some were mainland China visitors.  Tables were not cleaned so frequently.  Not a leisure place for coffee.', 'time': 1562309380, 'translated': False}]"
id_116,starbucks Plaza Hollywood,3.6,3431,2,https://maps.google.com/?cid=2591832155982561587,"['cafe', 'store', 'food', 'point_of_interest', 'establishment']","{'lat': 22.3405784, 'lng': 114.2019998}","[{'author_name': 'M Smith', 'author_url': 'https://www.google.com/maps/contrib/115377281923278480655/reviews', 'language': 'en', 'original_language': 'en', 'profile_photo_url': 'https://lh3.googleusercontent.com/a-/AD_cMMTLETcryqYxH03GtwH9_omuPeFsmAQLWjwyctfaGw=s128-c0x00000000-cc-rp-mo-ba5', 'rating': 3, 'relative_time_description': '9 months ago', 'text': ""Quite busy even on a Wednesday around 3 pm. The seats are closer together than at most Starbucks branches. There are maybe half a dozen bar-style seats and some bigger rectangular tables, and several low circular tables with soft chairs.\n\nYou can get some work done here if you can tune out background noise. The Wi-Fi is good. But this isn't the place for a quiet conversation or anything requiring a bit of privacy.\n\nI also didn't like that a man blatantly cut me in line and the employee still served him right away. But whatever. I wasn't feeling confrontational and I guess she wasn't either."", 'time': 1660745058, 'translated': False}, {'author_name': 'dingcosslili', 'author_url': 'https://www.google.com/maps/contrib/105610684579896461540/reviews', 'language': 'en', 'original_language': 'en', 'profile_photo_url': 'https://lh3.googleusercontent.com/a-/AD_cMMQEscy-2XQhrx8wnQnwXfT8NCc3Q0svL4qfDPvV0Q=s128-c0x00000000-cc-rp-mo-ba4', 'rating': 5, 'relative_time_description': '5 years ago', 'text': 'Nice 0pen area.. full of people blocked the tables.. .. all days long .. .. for wifi.. free.. .. many emtiy tables with bags .. but people.. are not on seats.. .. that not so nice for another guests.. .. Right.. ??', 'time': 1506597048, 'translated': False}, {'author_name': 'Ivan T', 'author_url': 'https://www.google.com/maps/contrib/111918805897327018649/reviews', 'language': 'en', 'original_language': 'en', 'profile_photo_url': 'https://lh3.googleusercontent.com/a-/AD_cMMT3FbFXV9Nga9AcjiJzObrYyaAialHW2IL44bk9zHU=s128-c0x00000000-cc-rp-mo-ba6', 'rating': 3, 'relative_time_description': '4 years ago', 'text': 'Good place to drop in, recharge your (human) batteries and watch the world go by.', 'time': 1549365297, 'translated': False}, {'author_name': 'Jhoan Fortuna Gloton', 'author_url': 'https://www.google.com/maps/contrib/111493924854101828078/reviews', 'language': 'en', 'original_language': 'en', 'profile_photo_url': 'https://lh3.googleusercontent.com/a-/AD_cMMTQnfbDvF6f7NQWPin0kyYYOckk_jebZkfBa3wKNw=s128-c0x00000000-cc-rp-mo-ba4', 'rating': 5, 'relative_time_description': '7 months ago', 'text': 'A bit cowded on weekend but they still follow safety protocols. Nice place to stay if you have a meet up, short meeting, studying or just relaxing while sipping a hot or cold drinks. The staff is nice and approachable. Most of the store is self service but I also find some like in Telford Plaza that has a service crew to help clean up the tables..', 'time': 1666522890, 'translated': False}, {'author_name': 'Hoai My Winder', 'author_url': 'https://www.google.com/maps/contrib/117618899774463356325/reviews', 'language': 'en', 'original_language': 'en', 'profile_photo_url': 'https://lh3.googleusercontent.com/a-/AD_cMMRIBwC5Kc-kH7Yxi5gIySIUYmx3KAZTmaZkvhyJhA=s128-c0x00000000-cc-rp-mo-ba4', 'rating': 5, 'relative_time_description': '4 years ago', 'text': 'Different flavors. Great customer service.', 'time': 1551995626, 'translated': False}]"
id_117,starbucks Cyberport Level 4,3.9,96,2,https://maps.google.com/?cid=344411919717062037,"['cafe', 'store', 'food', 'point_of_interest', 'establishment']","{'lat': 22.2613602, 'lng': 114.1306855}","[{'author_name': 'kiiltochii', 'author_url': 'https://www.google.com/maps/contrib/115064927302759914672/reviews', 'language': 'en', 'original_language': 'en', 'profile_photo_url': 'https://lh3.googleusercontent.com/a-/AD_cMMR40BwkTa1AbKyOwNsxoa4Q8MDzb5l89MVFLbpb2A=s128-c0x00000000-cc-rp-mo-ba5', 'rating': 4, 'relative_time_description': '3 years ago', 'text': 'Nice and small Starbucks coffee place. Probably the only staba I have ever come to with seating available at the moment.\nBarista was nice and professional.', 'time': 1561010072, 'translated': False}, {'author_name': 'Sam Wu', 'author_url': 'https://www.google.com/maps/contrib/113045187281329826840/reviews', 'language': 'en', 'original_language': 'en', 'profile_photo_url': 'https://lh3.googleusercontent.com/a-/AD_cMMQIQOivQe4HV7LH2o3Lg8rUAcv_0Pmuyt-jRSL3=s128-c0x00000000-cc-rp-mo-ba3', 'rating': 1, 'relative_time_description': '5 years ago', 'text': 'Terrible service and huge attitude problem. Workers just chatting with customers and not giving attention to the line. Napkin box running empty and the worker grudgingly refilled when asked. My wife spilled a drink and we were trying to clean up the table and all I heard from the worker was that I need to be more environmentally friendly and use less of his napkins so he needs to refill less often. Wow. Don’t ever bother going to this place. I don’t need this kind of attitude as a paying customer.', 'time': 1526547018, 'translated': False}, {'author_name': 'Patrick Li', 'author_url': 'https://www.google.com/maps/contrib/102452316842295524762/reviews', 'language': 'en', 'original_language': 'en', 'profile_photo_url': 'https://lh3.googleusercontent.com/a-/AD_cMMQzYCiiUHUmw0DBhFEQ6U0Yq282fm04VWQUpM9Q7L0=s128-c0x00000000-cc-rp-mo-ba6', 'rating': 4, 'relative_time_description': '9 months ago', 'text': 'Starbuck is Starbuck. Basically offering  the same products and services. This Starbuck is located at an open area within Cyberport. The setting and lighting are more comfortable with more space and natural light. Very relaxing.', 'time': 1661617347, 'translated': False}, {'author_name': 'Raman Gupta', 'author_url': 'https://www.google.com/maps/contrib/106192863922296690336/reviews', 'language': 'en', 'original_language': 'en', 'profile_photo_url': 'https://lh3.googleusercontent.com/a-/AD_cMMRQE91vE_q9VacUIrubmE-UTs3dj-gdDkTagefu3zo=s128-c0x00000000-cc-rp-mo-ba3', 'rating': 1, 'relative_time_description': '5 months ago', 'text': 'Asked for a vanilla cappuccino, but didn’t have vanilla in my coffee. Bad service.', 'time': 1671680340, 'translated': False}, {'author_name': 'Florence Tam', 'author_url': 'https://www.google.com/maps/contrib/111085592886033433814/reviews', 'language': 'en', 'original_language': 'en', 'profile_photo_url': 'https://lh3.googleusercontent.com/a/AAcHTtcKAGx--PdxEpDzpcN8NDmd4r7w5d8CWrc_iy30=s128-c0x00000000-cc-rp-mo-ba6', 'rating': 3, 'relative_time_description': '3 years ago', 'text': ""Yesterday I had coffee at a Starbucks in Aberdeen Centre. The environment was excellent, I ordered a cup of cold caramel coffee. The coffee didn't taste very strong because they added very little coffee powder but very much milk. This coffee was not good to drink. Besides, I saw that some people who did not buy food but took up the seats."", 'time': 1564565693, 'translated': False}]"
id_118,starbucks Hopewell Centre,3.8,401,2,https://maps.google.com/?cid=8912138007601445439,"['cafe', 'store', 'food', 'point_of_interest', 'establishment']","{'lat': 22.2746422, 'lng': 114.1717929}","[{'author_name': 'Anthony Degennaro', 'author_url': 'https://www.google.com/maps/contrib/106854899416841274983/reviews', 'language': 'en', 'original_language': 'en', 'profile_photo_url': 'https://lh3.googleusercontent.com/a-/AD_cMMSGzM1ZRqBlG5sYRaWJGXRNbjQMloUBC7PSAyZ31Q=s128-c0x00000000-cc-rp-mo-ba5', 'rating': 5, 'relative_time_description': '2 weeks ago', 'text': ""I have to say this is one of the best run Starbucks I've ever been to. The people that work here are the most efficient and friendly staff I've ever encountered at a Starbucks. Marcus, one of the Baristas, remembered my order and would have it ready before I was finished paying sometimes! Best Starbucks in Hong Kong to me!"", 'time': 1684471922, 'translated': False}, {'author_name': 'Desmond Phua', 'author_url': 'https://www.google.com/maps/contrib/108124362099549273200/reviews', 'language': 'en', 'original_language': 'en', 'profile_photo_url': 'https://lh3.googleusercontent.com/a-/AD_cMMQLPBrCdHll8dJ9O6FoFcbiWJuKcu0AnzGWMs6KeYo=s128-c0x00000000-cc-rp-mo-ba3', 'rating': 4, 'relative_time_description': '3 months ago', 'text': 'Another favorite Starbucks in Wan Chai. Not too crowded here on weekends.', 'time': 1677373431, 'translated': False}, {'author_name': 'zeacret', 'author_url': 'https://www.google.com/maps/contrib/108236297512543392492/reviews', 'language': 'en', 'original_language': 'en', 'profile_photo_url': 'https://lh3.googleusercontent.com/a-/AD_cMMQYQ8f3wwGD4MCV1Uv5y67zOgK4f65C3aoYRaKnFiQ=s128-c0x00000000-cc-rp-mo-ba6', 'rating': 3, 'relative_time_description': 'a month ago', 'text': 'Kinda slow process. Took like 10+ minutes to wait for a coffee.', 'time': 1681808948, 'translated': False}, {'author_name': 'Blue Pea', 'author_url': 'https://www.google.com/maps/contrib/110615832401434080758/reviews', 'language': 'en', 'original_language': 'en', 'profile_photo_url': 'https://lh3.googleusercontent.com/a/AAcHTtdMJyuHyOegxv2_JXCcv9bAB9jc6iOkgH9W2QBs=s128-c0x00000000-cc-rp-mo-ba4', 'rating': 2, 'relative_time_description': '2 years ago', 'text': 'No feeling of coming to Starbucks, the cashier don’t greet you, just tell you to wait... and come when it’s your turn to order. Didn’t check my record, never thank you after paying, never even follow procedure to tell you “please collect your drink from the station at the back and they will call your name”... my order was sitting there without any notification to me it’s ready. I had to walk up to the person to ask is that mine? To be only directed to wait for  the lady who is in charge of the station and asked what’s my name.\n\nHot chocolate was Luke warm and service was cold. No better than street cart coffee service..', 'time': 1608170346, 'translated': False}, {'author_name': 'Tor Chiu', 'author_url': 'https://www.google.com/maps/contrib/109139831390132108492/reviews', 'language': 'en', 'original_language': 'en', 'profile_photo_url': 'https://lh3.googleusercontent.com/a/AAcHTtcAuQj6XDzVseQNjg1KRYR57hGEcFtV4CNAY0Xw=s128-c0x00000000-cc-rp-mo-ba7', 'rating': 4, 'relative_time_description': '3 years ago', 'text': ""Better coffee and better service. Prices to match. Nitro was a bit underwhelming, affogato was fine, but it's difficult to mess that up right?"", 'time': 1588958404, 'translated': False}]"
id_119,starbucks AIA Tower ,3.6,472,2,https://maps.google.com/?cid=526648671422004934,"['cafe', 'food', 'store', 'point_of_interest', 'establishment']","{'lat': 22.2880413, 'lng': 114.1923207}","[{'author_name': 'sudhir Nair', 'author_url': 'https://www.google.com/maps/contrib/106691989041056135992/reviews', 'language': 'en', 'original_language': 'en', 'profile_photo_url': 'https://lh3.googleusercontent.com/a-/AD_cMMRkICfrRuaCctSothnekafMGQLNYU-PrGnj8BKPrw=s128-c0x00000000-cc-rp-mo-ba3', 'rating': 5, 'relative_time_description': 'a week ago', 'text': 'Nice place for a coffee and a quick snacks . This place is crowded most of time . If plan to do a meeting not very likely to have a peaceful . The staff is very polite', 'time': 1684765114, 'translated': False}, {'author_name': 'Mira M', 'author_url': 'https://www.google.com/maps/contrib/110426374357454847194/reviews', 'language': 'en', 'original_language': 'en', 'profile_photo_url': 'https://lh3.googleusercontent.com/a/AAcHTtfLxLRmHKcPeJiCBJ0P9D_Ul28o0749RB5D-UlI=s128-c0x00000000-cc-rp-mo-ba3', 'rating': 5, 'relative_time_description': '4 years ago', 'text': ""Loved their hot chocolate and this is the place in Hong Kong where you can get vegetarian food too. But it's very hard to get sits as it's always full with people sitting there for long hours."", 'time': 1535358813, 'translated': False}, {'author_name': 'tomato tam', 'author_url': 'https://www.google.com/maps/contrib/100750415791246578936/reviews', 'language': 'en', 'original_language': 'en', 'profile_photo_url': 'https://lh3.googleusercontent.com/a-/AD_cMMReUl9pR1OIrY2fCh0IL1z5T8KwQ5Hv9FHdhtJFRVA=s128-c0x00000000-cc-rp-mo-ba7', 'rating': 4, 'relative_time_description': '8 months ago', 'text': 'comfortable cafe. delicious coffee and vegetarian sandwiches. sunshine comes from French window.', 'time': 1663927170, 'translated': False}, {'author_name': 'CMS Cheng', 'author_url': 'https://www.google.com/maps/contrib/116868207751084371058/reviews', 'language': 'en', 'original_language': 'en', 'profile_photo_url': 'https://lh3.googleusercontent.com/a/AAcHTtfehogNjh6TdLyXaeZs9igEXXISsIvXridP4TE=s128-c0x00000000-cc-rp-mo', 'rating': 5, 'relative_time_description': '3 months ago', 'text': 'This Starbucks give the best services per my experience in Starbucks around the world, except the fact that they don’t have a toilet.', 'time': 1675614399, 'translated': False}, {'author_name': 'Opikom', 'author_url': 'https://www.google.com/maps/contrib/113136441311936936785/reviews', 'language': 'en', 'original_language': 'en', 'profile_photo_url': 'https://lh3.googleusercontent.com/a-/AD_cMMTCho8rTrE4ZPXviQjRu6g1iIPMAMntGVf6AteI4CI=s128-c0x00000000-cc-rp-mo-ba5', 'rating': 4, 'relative_time_description': '7 months ago', 'text': 'Cool and cozy besides the main street 😎', 'time': 1666498170, 'translated': False}]"
id_120,starbucks Nathan Hotel,3.7,381,2,https://maps.google.com/?cid=14174263917211352249,"['cafe', 'point_of_interest', 'store', 'food', 'establishment']","{'lat': 22.307698, 'lng': 114.171577}","[{'author_name': 'Fernando Coutinho', 'author_url': 'https://www.google.com/maps/contrib/112191625927475683228/reviews', 'language': 'en', 'original_language': 'en', 'profile_photo_url': 'https://lh3.googleusercontent.com/a-/AD_cMMRsBKCmA7Ce1kZ590z4ZWJwr1h83MpDdOcN4_m4=s128-c0x00000000-cc-rp-mo-ba3', 'rating': 1, 'relative_time_description': 'a month ago', 'text': 'very expensive. dirty place. poor quality food.\nordered a cappuccino received milk with a little of coffees. the table and chairs were terribly dirty.', 'time': 1681175454, 'translated': False}, {'author_name': 'tomato tam', 'author_url': 'https://www.google.com/maps/contrib/100750415791246578936/reviews', 'language': 'en', 'original_language': 'en', 'profile_photo_url': 'https://lh3.googleusercontent.com/a-/AD_cMMReUl9pR1OIrY2fCh0IL1z5T8KwQ5Hv9FHdhtJFRVA=s128-c0x00000000-cc-rp-mo-ba7', 'rating': 5, 'relative_time_description': '2 years ago', 'text': 'this is a small cafe but very comfortable. customers enjoy busy street view via French windows . cake, bakery,  sandwiches are available.  vegetarian food is served. convenient location. it is located on the ground floor of a hotel. there are a few staircases at the doorway.  for wheelchair users, it is better to go in or out via the shopping center access.', 'time': 1594689800, 'translated': False}, {'author_name': 'Lina Butler', 'author_url': 'https://www.google.com/maps/contrib/111831430775232906292/reviews', 'language': 'en', 'original_language': 'en', 'profile_photo_url': 'https://lh3.googleusercontent.com/a-/AD_cMMQgjzs4SxKuDr3cW9-5HX86BKwWqp9UCudP3oJhxA=s128-c0x00000000-cc-rp-mo-ba5', 'rating': 1, 'relative_time_description': '2 weeks ago', 'text': 'Bad service. Bought coffee and couldn’t taste any coffee at all. Curious to know what are their standards. Starbucks isn’t my favourite place to get coffee, but even if you go to Starbucks in other countries you know you’ll get that coffee hit. This tasted more like a coffee flavoured milk if anything. Not the usual Starbucks standard.', 'time': 1684385929, 'translated': False}, {'author_name': 'Michael Chan', 'author_url': 'https://www.google.com/maps/contrib/105797007133986149167/reviews', 'language': 'en', 'original_language': 'en', 'profile_photo_url': 'https://lh3.googleusercontent.com/a-/AD_cMMR_QY5c3vwskP6FzeS8l2b2FuYaFy6eeO_ip7oFkg=s128-c0x00000000-cc-rp-mo-ba5', 'rating': 4, 'relative_time_description': '2 years ago', 'text': 'same as most starbuck except the staff at this one went beyond its service to serve the food & drinks to you table might be because it was not too busy either way very kind of them great job :D', 'time': 1606356227, 'translated': False}, {'author_name': 'ssg', 'author_url': 'https://www.google.com/maps/contrib/114154887650952138673/reviews', 'language': 'en', 'original_language': 'en', 'profile_photo_url': 'https://lh3.googleusercontent.com/a-/AD_cMMQcuqQGxbrW0yH6DLkNGS620HqpCtAd-HjhHK47Gw=s128-c0x00000000-cc-rp-mo-ba8', 'rating': 4, 'relative_time_description': '2 years ago', 'text': 'Starbucks have launched two new tea frappuccinos, the Double Chocolate Green Tea Frappuccino and Chocolate Black Tea Frappuccino.\n\nI ordered the Chocolate Black Tea Frappuccino which has a layer of Earl Grey tea jelly at the bottom topped with black tea frappuccino blended with Kenyan tea leaves and chocolate java chips.\n\nThis is the best frappuccino I have ever had because there is a strong Earl grey flavour as well as chocolate and the jelly at the bottom is really nice.', 'time': 1596662347, 'translated': False}]"
