location_id,location,rating,num_rating,price_level,url,types,coordinates,top5reviews
id_74,starbucks Aberdeen Centre Shop#6-9,3.7,263,2,https://maps.google.com/?cid=11924604813543955631,"['cafe', 'store', 'food', 'point_of_interest', 'establishment']","{'lat': 22.2485955, 'lng': 114.1546707}","[{'author_name': 'Florence Tam', 'author_url': 'https://www.google.com/maps/contrib/111085592886033433814/reviews', 'language': 'en', 'original_language': 'en', 'profile_photo_url': 'https://lh3.googleusercontent.com/a/AAcHTtcKAGx--PdxEpDzpcN8NDmd4r7w5d8CWrc_iy30=s128-c0x00000000-cc-rp-mo-ba6', 'rating': 3, 'relative_time_description': '4 years ago', 'text': 'Starbucks is known for selling quality coffee. It has many branches in Hong Kong. Today I bought a cold caramel coffee. It tastes really good. I told the clerk that I asked for less sweetness and less ice. However, she did not fulfill my request. The drink was very sweet. This restaurant has an ideal environment, plus free WiFi. Sitting here to enjoy coffee, it feels good.', 'time': 1533730339, 'translated': False}, {'author_name': 'Rukoyah Titi', 'author_url': 'https://www.google.com/maps/contrib/103218254695725867759/reviews', 'language': 'en', 'original_language': 'en', 'profile_photo_url': 'https://lh3.googleusercontent.com/a-/AD_cMMSr_x2VX06yhg7d23lBMfKmKJrrDdHvSh4p7E8jMw=s128-c0x00000000-cc-rp-mo-ba4', 'rating': 2, 'relative_time_description': '2 years ago', 'text': ""My boss is a big fan of you. Almost every single day she orders a cup of coffee. She loves hot Oatmeal Latte Macchiato.\n\nToday, as usual, I help her order a cup of coffee. I went to Aberdeen Center branch as I brought some fruits and veggies too in the market. This not my first time to make an order here but this is my first time to get unhappy experience 🥺🥺. I order Oatmeal Latte Macchiato, the staff confirmed it, then I said it again, Oatmeal Latte Macchiato, Hot. When I came back home and my boss drank the coffee, turn out it wasn't Oat Latte, I rushed to check the receipt, yup it wasn't.\n\nI also take a part on this unhappy event but I hope we can always have a happy time in the future.\n\nLove you Starbucks 🤗🤗"", 'time': 1619169267, 'translated': False}, {'author_name': 'Calvin LI', 'author_url': 'https://www.google.com/maps/contrib/102347982211666072747/reviews', 'language': 'en', 'original_language': 'en', 'profile_photo_url': 'https://lh3.googleusercontent.com/a-/AD_cMMSwLP-FPWpXYdHuk7ftXKMZ7uDfuEUvaAi66uzD53g=s128-c0x00000000-cc-rp-mo', 'rating': 4, 'relative_time_description': 'a year ago', 'text': 'The drinks are very good and staffs are very polite. Clean environment. 😃👍🏻👍🏻👍🏻', 'time': 1646560634, 'translated': False}, {'author_name': 'Andrew Smyth', 'author_url': 'https://www.google.com/maps/contrib/112430759158828568933/reviews', 'language': 'en', 'original_language': 'en', 'profile_photo_url': 'https://lh3.googleusercontent.com/a-/AD_cMMTYJj4TARSVHISmRs92N7dhVehTGAEjQ9v0tbBgow=s128-c0x00000000-cc-rp-mo', 'rating': 2, 'relative_time_description': '4 years ago', 'text': 'Okay coffee.  Biggest problem is that on weekends and on afternoons all seats taken by students and other people who have not bought from Starbucks (or if they have bought they are lingering way after it has been consumed) meaning impossible for genuine customers to get a seat.', 'time': 1544341833, 'translated': False}, {'author_name': 'Douglas Wong', 'author_url': 'https://www.google.com/maps/contrib/101610725505918033033/reviews', 'language': 'en', 'original_language': 'en', 'profile_photo_url': 'https://lh3.googleusercontent.com/a-/AD_cMMSqLWSP50G2MpFlAHLoorIlwDBXvBYXj_9wuLf_gQ=s128-c0x00000000-cc-rp-mo-ba7', 'rating': 4, 'relative_time_description': '4 years ago', 'text': 'Can look down from second level with good view. Shopping center comfortable and air conditioned. Toilet convenient.', 'time': 1549800673, 'translated': False}]"
id_75,starbucks Home Square,3.9,172,2,https://maps.google.com/?cid=14272731301515874921,"['cafe', 'point_of_interest', 'store', 'food', 'establishment']","{'lat': 22.3852209, 'lng': 114.1879684}","[{'author_name': 'Adam Newbold', 'author_url': 'https://www.google.com/maps/contrib/102208215393791542367/reviews', 'language': 'en', 'original_language': 'en', 'profile_photo_url': 'https://lh3.googleusercontent.com/a-/AD_cMMQYA9tGsM2iibZy3FW6OMfXtObHwW8-eC3YVyQJ51Q=s128-c0x00000000-cc-rp-mo-ba7', 'rating': 5, 'relative_time_description': '3 years ago', 'text': 'Comfortable and convenient location. It ticks the boxes you\'d expect from a Starbucks (except for the ""stay here"" mugs if you plan to stick around and don\'t need to-go cups). The seating options are great, which makes it a popular place for students. The outdoor covered seating area is also very nice, with about 5-6 tables and chairs available.', 'time': 1581170402, 'translated': False}, {'author_name': 'Eswiss64', 'author_url': 'https://www.google.com/maps/contrib/114590350627626862432/reviews', 'language': 'en', 'original_language': 'en', 'profile_photo_url': 'https://lh3.googleusercontent.com/a-/AD_cMMRua2qehrSsrCAAcM2RmTd-cSTuogN3F42rygT08w=s128-c0x00000000-cc-rp-mo-ba6', 'rating': 5, 'relative_time_description': '2 years ago', 'text': 'Excellent service by friendly staff, prompt and professional. Order made and served in no time. Airy seating with outside views. This Starbucks offers outdoor seating too. Highly recommended.', 'time': 1596618197, 'translated': False}, {'author_name': 'Day Chung', 'author_url': 'https://www.google.com/maps/contrib/107932399959513771449/reviews', 'language': 'en', 'original_language': 'en', 'profile_photo_url': 'https://lh3.googleusercontent.com/a-/AD_cMMTnCxaTzqvgp07xqFMlgKTObSqyf3zMg3EwE3YPoUk=s128-c0x00000000-cc-rp-mo-ba3', 'rating': 5, 'relative_time_description': '6 years ago', 'text': 'Nice place and good views', 'time': 1482056300, 'translated': False}, {'author_name': 'Arne Theuerkauf', 'author_url': 'https://www.google.com/maps/contrib/109583289482073426333/reviews', 'language': 'en', 'original_language': 'en', 'profile_photo_url': 'https://lh3.googleusercontent.com/a-/AD_cMMT3w-zxnNtDJkODCmscknvMKpMtKmWlszU3ZzOU56Q=s128-c0x00000000-cc-rp-mo-ba8', 'rating': 4, 'relative_time_description': '5 years ago', 'text': 'Nice Starbucks, but as usual, seating is limited and many people just seem to stay all day.', 'time': 1500714132, 'translated': False}, {'author_name': 'M Smith', 'author_url': 'https://www.google.com/maps/contrib/115377281923278480655/reviews', 'language': 'en', 'original_language': 'en', 'profile_photo_url': 'https://lh3.googleusercontent.com/a-/AD_cMMTLETcryqYxH03GtwH9_omuPeFsmAQLWjwyctfaGw=s128-c0x00000000-cc-rp-mo-ba5', 'rating': 4, 'relative_time_description': '10 months ago', 'text': ""Nice atmosphere with a wide variety of seat/table types, including some outdoor seating on a spacious deck. While this is a larger Starbucks, the volume of people in HomeSquare is high, so it can be hard to get a seat.\n\nThe big windows look pretty, but it gets rather warm and the sunlight hits in a mildly annoying way in certain seats. If you're using a laptop, it may also make your screen hard to see. When I come here, I only order iced drinks."", 'time': 1658991601, 'translated': False}]"
id_76,starbucks Gala Place,3.9,1002,2,https://maps.google.com/?cid=9315803402310908145,"['cafe', 'point_of_interest', 'store', 'food', 'establishment']","{'lat': 22.3151303, 'lng': 114.171109}","[{'author_name': 'Wendy', 'author_url': 'https://www.google.com/maps/contrib/104146232870415645513/reviews', 'language': 'en', 'original_language': 'en', 'profile_photo_url': 'https://lh3.googleusercontent.com/a/AAcHTtcjcIWvBs7PHCzfnEbjmjRBDJac_mDRHpUmgg8eHw=s128-c0x00000000-cc-rp-mo-ba5', 'rating': 4, 'relative_time_description': '3 weeks ago', 'text': 'Comfortable and clean. A nice place to sit in and relax after a day of shopping. Good service, the staff are polite.', 'time': 1683808400, 'translated': False}, {'author_name': 'Chayut O', 'author_url': 'https://www.google.com/maps/contrib/107963157156924123092/reviews', 'language': 'en', 'original_language': 'en', 'profile_photo_url': 'https://lh3.googleusercontent.com/a-/AD_cMMRa5TGky3UlAhEh4Y2K1ysP2L4b-Gw5moppu59u=s128-c0x00000000-cc-rp-mo-ba6', 'rating': 4, 'relative_time_description': '4 months ago', 'text': 'Plenty of sitting space. Most people sit here for long time. But toilet need key and is at level 16!!!', 'time': 1674385480, 'translated': False}, {'author_name': 'Claudzs Marie', 'author_url': 'https://www.google.com/maps/contrib/107715580424660760715/reviews', 'language': 'en', 'original_language': 'en', 'profile_photo_url': 'https://lh3.googleusercontent.com/a-/AD_cMMRk2gaOzDpWvaBvtVne3BwM4Ptshksgg-qa70Zq=s128-c0x00000000-cc-rp-mo-ba3', 'rating': 4, 'relative_time_description': 'a month ago', 'text': 'Self-service. We love their banana bread and as for our go to drinks, I had a latte and husband had tha caramel latte. A good place to have a conversation while having coffee.', 'time': 1680685110, 'translated': False}, {'author_name': 'Ivan Lam', 'author_url': 'https://www.google.com/maps/contrib/112403987693678430009/reviews', 'language': 'en', 'original_language': 'en', 'profile_photo_url': 'https://lh3.googleusercontent.com/a-/AD_cMMQNaMnk203Ho25J8AYPMGBk-uTAX6Qwhw_5y_gq=s128-c0x00000000-cc-rp-mo-ba7', 'rating': 5, 'relative_time_description': '3 years ago', 'text': 'Located in basement one of Gala Palace, this Starbuck outlet is easily accessible via an escalator from Dundas Street. With 4,500 square feet of floor space, there are ample seats available here. Interestingly, there is also daily coffee tasting available at this particular outlet as well.', 'time': 1561372513, 'translated': False}, {'author_name': 'Don Taylor', 'author_url': 'https://www.google.com/maps/contrib/114513790442306703396/reviews', 'language': 'en', 'original_language': 'en', 'profile_photo_url': 'https://lh3.googleusercontent.com/a-/AD_cMMTN1O3rgCzhP_UExfKLDBsgBBG6tQu3yb-aqq_0=s128-c0x00000000-cc-rp-mo-ba4', 'rating': 5, 'relative_time_description': '4 years ago', 'text': 'A large & lively yet quiet Café infused with gorgeous hipster music & ever friendly staff. Lighting that transitions between cozy & bright suiting your every need from unwinding to working. A well flavored experience for all.', 'time': 1557392080, 'translated': False}]"
id_77,starbucks Lei King Wan,4.0,254,2,https://maps.google.com/?cid=1699619509816817481,"['cafe', 'point_of_interest', 'store', 'food', 'establishment']","{'lat': 22.2849282, 'lng': 114.2233592}","[{'author_name': 'Quentin', 'author_url': 'https://www.google.com/maps/contrib/118443093967656392850/reviews', 'language': 'en', 'original_language': 'en', 'profile_photo_url': 'https://lh3.googleusercontent.com/a-/AD_cMMQ70NXqdcfNBs36AFWIzKJFu34gXSDhXTjqate7Pw=s128-c0x00000000-cc-rp-mo', 'rating': 5, 'relative_time_description': '3 weeks ago', 'text': 'The cashier and staff called Grace was really nice and welcoming !! Absolutely loving the awesome service ! Give her a raise !', 'time': 1683453080, 'translated': False}, {'author_name': 'Carrie King', 'author_url': 'https://www.google.com/maps/contrib/112150927571938663907/reviews', 'language': 'en', 'original_language': 'en', 'profile_photo_url': 'https://lh3.googleusercontent.com/a-/AD_cMMQGpAL7woCz-HKphuP9N7t2LFj5U2M40XRKHdC2xA=s128-c0x00000000-cc-rp-mo-ba4', 'rating': 4, 'relative_time_description': '3 years ago', 'text': 'This Starbucks is always go-to coffee shop after run. I will say Starbucks never has the best coffee but the service of this shop is superb. The barista is super nice and really helpful. The cashier is friendly and we sometimes will chitchat. I also like the environment as I can sit by the window and seeing people walking. Nice Starbucks.', 'time': 1577234721, 'translated': False}, {'author_name': 'Nicola Morgan', 'author_url': 'https://www.google.com/maps/contrib/103998258739128083059/reviews', 'language': 'en', 'original_language': 'en', 'profile_photo_url': 'https://lh3.googleusercontent.com/a-/AD_cMMTxmeo5xiyvr8gi7ypt-usxd_doUR-NhGrmMGGF1TE=s128-c0x00000000-cc-rp-mo-ba4', 'rating': 4, 'relative_time_description': 'a year ago', 'text': ""Took a while to get my order sorted and couldn't pay via eps, since their card machine doesn't have a long enough cable. Thankfully i had enough cash on me though.\n\nFood and coffee was good though and in line with the usual Starbucks standard."", 'time': 1642568319, 'translated': False}, {'author_name': 'Sarah Gerlach', 'author_url': 'https://www.google.com/maps/contrib/111511327812380596002/reviews', 'language': 'en', 'original_language': 'en', 'profile_photo_url': 'https://lh3.googleusercontent.com/a-/AD_cMMT4AvyAkTNyRammY3iiYHPd93IWvxPPWLfPuMxgGsE=s128-c0x00000000-cc-rp-mo-ba4', 'rating': 5, 'relative_time_description': '3 months ago', 'text': 'Friendly and helpful staff. Good service', 'time': 1675813429, 'translated': False}, {'author_name': 'Matty Gavas', 'author_url': 'https://www.google.com/maps/contrib/114503084924289791726/reviews', 'language': 'en', 'original_language': 'en', 'profile_photo_url': 'https://lh3.googleusercontent.com/a-/AD_cMMTVFHCWL7RIa-pW5ctlREfMzxiRu0-VlTb1WJ1PjA=s128-c0x00000000-cc-rp-mo', 'rating': 4, 'relative_time_description': '2 months ago', 'text': 'nice to relax and surf while drinking your coffee', 'time': 1678179837, 'translated': False}]"
id_78,starbucks Mega Mall,3.7,305,2,https://maps.google.com/?cid=13117998463376972896,"['cafe', 'point_of_interest', 'store', 'food', 'establishment']","{'lat': 22.4521541, 'lng': 114.1710129}","[{'author_name': 'Tina Hon', 'author_url': 'https://www.google.com/maps/contrib/113917041321128550623/reviews', 'language': 'en', 'original_language': 'en', 'profile_photo_url': 'https://lh3.googleusercontent.com/a-/AD_cMMSgdVUMSh0ovUYRc2iNetPPi1KB5VEvUDg-mF0q-g=s128-c0x00000000-cc-rp-mo-ba2', 'rating': 5, 'relative_time_description': '8 months ago', 'text': ""No complaints with the staffs but atleast have someone to clean the tables as we need to sit on a table with lot of rubbish that weren't ours. 🤔"", 'time': 1663501142, 'translated': False}, {'author_name': 'Richard Fan', 'author_url': 'https://www.google.com/maps/contrib/100873384518043189939/reviews', 'language': 'en', 'original_language': 'en', 'profile_photo_url': 'https://lh3.googleusercontent.com/a-/AD_cMMQ9OZLhrWyrrHBJsD8fu5BmhQXMqK0bAYfsjSGD5w=s128-c0x00000000-cc-rp-mo-ba5', 'rating': 5, 'relative_time_description': '2 years ago', 'text': ""Socially distancing measures have made the whole coffee shop much more pleasant as you don't have the usual 3 to 5 people hovering over your table"", 'time': 1613291768, 'translated': False}, {'author_name': 'Eunice Cheung', 'author_url': 'https://www.google.com/maps/contrib/100101008933794225037/reviews', 'language': 'en', 'original_language': 'en', 'profile_photo_url': 'https://lh3.googleusercontent.com/a/AAcHTtexKPFxAotkb-vs3onjIgzoeBqCvdHj4MRo_vot=s128-c0x00000000-cc-rp-mo-ba6', 'rating': 5, 'relative_time_description': '2 years ago', 'text': 'Good environment with many kind of shops\nAnd there’s a robot walking around for disinfecting\nThis can relieve the worries of most people', 'time': 1597899596, 'translated': False}, {'author_name': 'Danny Wong', 'author_url': 'https://www.google.com/maps/contrib/104068399528678505141/reviews', 'language': 'en', 'original_language': 'en', 'profile_photo_url': 'https://lh3.googleusercontent.com/a-/AD_cMMSPl3IccrOgMoGJHpVwx997E2StQa7UtMHf4zmuPOw=s128-c0x00000000-cc-rp-mo-ba6', 'rating': 4, 'relative_time_description': 'a year ago', 'text': 'A good place for a quick bite.', 'time': 1641113112, 'translated': False}, {'author_name': 'Joshua Fung', 'author_url': 'https://www.google.com/maps/contrib/105548779833238371754/reviews', 'language': 'en', 'original_language': 'en', 'profile_photo_url': 'https://lh3.googleusercontent.com/a/AAcHTtdAdCXO5_oOAX12CBNT7fDl4UW2ph4WzHPxf-xk=s128-c0x00000000-cc-rp-mo-ba4', 'rating': 5, 'relative_time_description': '6 years ago', 'text': 'An excellent place to chill,  work or meet up with friends. The shop offers standard food and beverages you expect from the coffee chain and a verity of seatings. Large solid wood table for comfortable typing with laptop, sofa chairs for snacks and a relatively isolated high table for meet ups.', 'time': 1485269192, 'translated': False}]"
id_79,starbucks Maxim's Centre,4.0,2,2,https://maps.google.com/?cid=4324819717151965275,"['cafe', 'food', 'point_of_interest', 'establishment']","{'lat': 22.3360427, 'lng': 114.1469599}","[{'author_name': 'ssg', 'author_url': 'https://www.google.com/maps/contrib/114154887650952138673/reviews', 'language': 'en', 'original_language': 'en', 'profile_photo_url': 'https://lh3.googleusercontent.com/a-/AD_cMMQcuqQGxbrW0yH6DLkNGS620HqpCtAd-HjhHK47Gw=s128-c0x00000000-cc-rp-mo-ba8', 'rating': 3, 'relative_time_description': '2 years ago', 'text': ""As I was in the area, I discovered that this whole building belonged to the Maxims group so went in there out of curiosity and discovered a Starbucks.\n\nThere is another restaurant on the 1st floor but it is only for Maxim's staff.\n\nAs it was lunch had the meatball and potato pie, pancakes and Chocolate red tea latte.\n\nThe meatball and potato pie was held in a flakey tart base and it was filled with rich tangy tomato sauce which was also quite sweet at the same time.\n\nThe meatballs in the pie were quite nice as it had lots of herbs and tasted more like sausage meat.\n\nYou could tell the pancakes were pre made and taken from a stack and heated as they were neatly stuck together in a pile.\n\nThey were a bit dry and sweet but dipping it in the drink made it more palatable.\n\nFinished with the Chocolate red tea which was rather sweet and the chocolate was more prominent than the tea so I didn't really like it."", 'time': 1599170315, 'translated': False}, {'author_name': 'Darren Gilkison', 'author_url': 'https://www.google.com/maps/contrib/115114072321762307977/reviews', 'language': 'en', 'original_language': 'en', 'profile_photo_url': 'https://lh3.googleusercontent.com/a/AAcHTtcvcQzOylm_ZkIxrxzGmxU9TpkFnEfK6bxXuyjU=s128-c0x00000000-cc-rp-mo', 'rating': 5, 'relative_time_description': '8 months ago', 'text': 'Outstanding customer service and the food is always fresh!', 'time': 1663807814, 'translated': False}]"
id_80,starbucks One Bay East,3.7,64,2,https://maps.google.com/?cid=14388423898717662283,"['cafe', 'store', 'food', 'point_of_interest', 'establishment']","{'lat': 22.31603999999999, 'lng': 114.2145309}","[{'author_name': 'Ray Hau', 'author_url': 'https://www.google.com/maps/contrib/118071092754930599039/reviews', 'language': 'en', 'original_language': 'en', 'profile_photo_url': 'https://lh3.googleusercontent.com/a-/AD_cMMTUAebVEwL1eB86Up0pEGNmo4fD9gtiuXs2va5VTZA=s128-c0x00000000-cc-rp-mo-ba6', 'rating': 1, 'relative_time_description': '6 years ago', 'text': ""It's typical Starbucks. Modern, clean and comfortable but if you want coffee (or even a snack), walk the 1 minute across the road to One Little Room.\n\nI've never had a good coffee, it's relatively expensive, the food is not fresh. Apart from the decor and seating there is nothing worth coming here for.  For those currently rating this place 4/5-stars, do try One Little Room (less than 1 minute away) or even MG Café (5 mins down Hoi Bun Road) instead and see the difference."", 'time': 1494322338, 'translated': False}, {'author_name': 'Lucas Castellani', 'author_url': 'https://www.google.com/maps/contrib/114404748582167914498/reviews', 'language': 'en', 'original_language': 'en', 'profile_photo_url': 'https://lh3.googleusercontent.com/a/AAcHTtd08KIPG3Mu1a0U7hp4AWFa1dUGj7m03jgIJ59wpw=s128-c0x00000000-cc-rp-mo', 'rating': 1, 'relative_time_description': '4 years ago', 'text': 'I usually always stop by a Starbucks to have my coffee, but this one in HK is NOT on the right standards. I like to come here to take a coffee work on my laptop, but this time I had a ridiculous 30 min wifi after spending more than HK$100. When I asked for another ""activation code"" I was declined and asked to buy more time.\n\nThat\'s disappointing for someone spending more than $150 per month on this brand alone.', 'time': 1546499571, 'translated': False}, {'author_name': 'Maureen Boost', 'author_url': 'https://www.google.com/maps/contrib/105106328367584641765/reviews', 'language': 'en', 'original_language': 'en', 'profile_photo_url': 'https://lh3.googleusercontent.com/a/AAcHTtfIgluInozEN9UnfuuLT6SPK1m_ggHc4wxyLmxH=s128-c0x00000000-cc-rp-mo-ba4', 'rating': 5, 'relative_time_description': '2 years ago', 'text': 'Just what I needed when feeling shattered yesterday afternoon. Staff were friendly and a cold late did the trick', 'time': 1600405030, 'translated': False}, {'author_name': 'Jnanesh Kodical', 'author_url': 'https://www.google.com/maps/contrib/101663195829474236972/reviews', 'language': 'en', 'original_language': 'en', 'profile_photo_url': 'https://lh3.googleusercontent.com/a-/AD_cMMSsqdRN7ubwLkq_anXVK3XruzKbPTm0y71xXHyU-2M=s128-c0x00000000-cc-rp-mo-ba7', 'rating': 5, 'relative_time_description': '2 years ago', 'text': 'The English Breakfast Ice tea lemonade is brilliant!', 'time': 1620211968, 'translated': False}, {'author_name': 'Kenneth Cheuk', 'author_url': 'https://www.google.com/maps/contrib/113218550962553931810/reviews', 'language': 'en', 'original_language': 'en', 'profile_photo_url': 'https://lh3.googleusercontent.com/a-/AD_cMMQwFYhoTEmDABb6Ugyz3T-J1mpu1y5Lb60GX1YTy4c=s128-c0x00000000-cc-rp-mo-ba4', 'rating': 4, 'relative_time_description': '4 years ago', 'text': 'A nice environment but it closes early.', 'time': 1551270341, 'translated': False}]"
id_81,starbucks Moko,3.8,213,2,https://maps.google.com/?cid=8936629529026393944,"['cafe', 'point_of_interest', 'store', 'food', 'establishment']","{'lat': 22.3244312, 'lng': 114.1732183}","[{'author_name': 'Katie (Katie’s Kitchen Baking)', 'author_url': 'https://www.google.com/maps/contrib/103289865469554891344/reviews', 'language': 'en', 'original_language': 'en', 'profile_photo_url': 'https://lh3.googleusercontent.com/a-/AD_cMMRHKOOVc_bd8gAi6NTQsWwUWk3Dk8GsyD-hXDDx=s128-c0x00000000-cc-rp-mo', 'rating': 1, 'relative_time_description': 'a week ago', 'text': 'Stated open at 07:30am, but staff claimed open at 08:00am.  The worst part is the staff attitude, he was so rude!  Never experienced this type of service at any other Starbucks!', 'time': 1685058502, 'translated': False}, {'author_name': 'Franck Lacuisse', 'author_url': 'https://www.google.com/maps/contrib/107310331700945323398/reviews', 'language': 'en', 'original_language': 'en', 'profile_photo_url': 'https://lh3.googleusercontent.com/a-/AD_cMMTn6Spf5Z8mZGUN1RMWJ46Ybtd4oOKuf8gxNZmtBCA=s128-c0x00000000-cc-rp-mo-ba4', 'rating': 4, 'relative_time_description': '3 weeks ago', 'text': 'I put 3 stars for atmosphere because they have to deal with noisy job around.\nGoodluck to the worker who have to deal with one more week of crazy noise.', 'time': 1683593107, 'translated': False}, {'author_name': 'Ter Lau', 'author_url': 'https://www.google.com/maps/contrib/111892635025436007532/reviews', 'language': 'en', 'original_language': 'en', 'profile_photo_url': 'https://lh3.googleusercontent.com/a-/AD_cMMRiXsNFW3iJSwtdBfl_1zgvQhuMIbY3mKTlNLm9sg=s128-c0x00000000-cc-rp-mo-ba6', 'rating': 5, 'relative_time_description': '6 years ago', 'text': 'Good place when you are waiting for movie 🎥', 'time': 1486001988, 'translated': False}, {'author_name': 'Jack', 'author_url': 'https://www.google.com/maps/contrib/117703744021482614525/reviews', 'language': 'en', 'original_language': 'en', 'profile_photo_url': 'https://lh3.googleusercontent.com/a-/AD_cMMSptiOYRKjeGraQ-6uK2ppI570SIMCoHZHR-eJSpw=s128-c0x00000000-cc-rp-mo', 'rating': 5, 'relative_time_description': '4 years ago', 'text': 'Very good starbucks, good coffee and very good service at this particular one.', 'time': 1555900516, 'translated': False}, {'author_name': 'Jasper Kwong', 'author_url': 'https://www.google.com/maps/contrib/107282549940669564102/reviews', 'language': 'en', 'original_language': 'en', 'profile_photo_url': 'https://lh3.googleusercontent.com/a-/AD_cMMRz-aIhG9T7DpRVGl8d0kqsDW9avU3xtNluxn1c-A=s128-c0x00000000-cc-rp-mo-ba5', 'rating': 4, 'relative_time_description': '4 years ago', 'text': 'This starbucks is at the corner next to the escalator on 2nd floor.', 'time': 1548934475, 'translated': False}]"
